{
  "name": "convertidor",
  "description": "Renombrar STL/PTS entre convenciones (regex + template), corregir puntos contra una malla, inspeccionar/extraer volúmenes de mallas multi-parte, con variantes batch en paralelo, y exportar como ToothFORM (pieza con referencias del robot y QR, -gum.stl, -tooth.ply) sin ToothFORM.",
  "source": "workflow-bot-plugin-convertidor",
  "path": "convertidor",
  "ports": [
    "fs"
  ],
  "maintainer": "OperacionesMejoras",
  "repo_url": "https://github.com/OperacionesMejoras/workflow-bot-plugins",
  "compatible_core": ">=0.3.0b4",
  "compatible_runtime": "v0.4.2-beta.1",
  "license": "MIT"
}
