{
  "name": "laya",
  "description": "Sí/no, elegir o puntuar un texto o una fila con Laya, un modelo local. Requiere laya-serve aparte (pip install laya fastapi uvicorn, ~1,5 GB); ver laya/README.md.",
  "source": "workflow-bot-plugin-laya",
  "path": "laya",
  "ports": [
    "http"
  ],
  "maintainer": "OperacionesMejoras",
  "repo_url": "https://github.com/OperacionesMejoras/workflow-bot-plugins",
  "compatible_core": ">=0.3.1b13",
  "license": "MIT"
}
