{
  "name": "bots",
  "description": "Hablar con otros Bots de la red desde un flujo: qué hacen, mandarles un caso sin esperar, esperar el resultado, y comparar qué flujos o registros tienen distinto.",
  "source": "workflow-bot-plugin-bots",
  "path": "bots",
  "ports": [
    "http",
    "clock"
  ],
  "maintainer": "OperacionesMejoras",
  "repo_url": "https://github.com/OperacionesMejoras/workflow-bot-plugins",
  "compatible_core": ">=0.3.0b4",
  "license": "MIT"
}
