{
  "name": "archivos",
  "description": "Mover, copiar, eliminar, renombrar (uno, o una lista entera con un regex que saca variables del nombre), buscar (bajando primero a la subcarpeta del caso, por etiqueta o regex, dejando afuera la salida de una corrida anterior) y comparar el conteo de dos carpetas, contra el port fs.",
  "source": "workflow-bot-plugin-archivos",
  "path": "archivos",
  "ports": [
    "fs"
  ],
  "maintainer": "OperacionesMejoras",
  "repo_url": "https://github.com/OperacionesMejoras/workflow-bot-plugins",
  "compatible_core": ">=0.3.0b4",
  "license": "MIT"
}
