{
  "name": "toothform",
  "description": "Exportar STL con QR y placa base en ToothFORM (por cmd, en tandas para que una caída no se lleve el caso entero, o por ventana), o lo mismo con Enkukador sin ToothFORM, y leer su log. Incluye ToothCAM: mover a la vigilada y esperar.",
  "source": "workflow-bot-plugin-toothform",
  "path": "toothform",
  "ports": [
    "process",
    "fs",
    "clock",
    "window"
  ],
  "maintainer": "OperacionesMejoras",
  "repo_url": "https://github.com/OperacionesMejoras/workflow-bot-plugins",
  "compatible_core": ">=0.3.0b4",
  "license": "MIT"
}
