{
  "name": "sqlite",
  "description": "Consultas de sólo lectura, guardadas y reutilizables en un flujo, contra un archivo SQLite externo (sqlite.consultar).",
  "source": "workflow-bot-plugin-sqlite",
  "path": "sqlite",
  "ports": [
    "sqlite_file"
  ],
  "maintainer": "OperacionesMejoras",
  "repo_url": "https://github.com/OperacionesMejoras/workflow-bot-plugins",
  "compatible_core": ">=0.3.1b18",
  "license": "MIT"
}
